"No.","Time","Source","Destination","Protocol","Length","Info"
"1","0.000000","192.168.1.10","192.168.1.30","CIP","134","'HMI_PLANT_RESET' - Service (0x4d)"
"2","0.000009","192.168.1.40","192.168.1.50","TCP","64","53056  >  44818 [ACK] Seq=1 Ack=1 Win=8130 Len=0"
"3","0.000012","192.168.1.10","192.168.1.30","CIP CM","128","Unconnected Send: 'HMI_LIT301' - Service (0x4c)"
"4","0.000169","192.168.1.30","192.168.1.10","TCP","64","44818  >  54086 [ACK] Seq=1 Ack=77 Win=8116 Len=0"
"5","0.000179","192.168.1.50","192.168.1.20","CIP","148","Success: Service (0x4c)"
"6","0.000183","192.168.1.30","192.168.1.10","TCP","64","44818  >  54086 [ACK] Seq=1 Ack=147 Win=8046 Len=0"
"7","0.000186","192.168.1.50","192.168.1.20","CIP","148","Success: Service (0x4c)"
"8","0.000345","192.168.1.20","192.168.1.50","TCP","64","52992  >  44818 [ACK] Seq=1 Ack=91 Win=8102 Len=0"
"9","0.000355","192.168.1.50","192.168.1.20","CIP","148","Success: Service (0x4c)"
"10","0.000358","192.168.1.20","192.168.1.50","TCP","64","52992  >  44818 [ACK] Seq=1 Ack=181 Win=8012 Len=0"
"11","0.000361","192.168.1.50","192.168.1.20","CIP","148","Success: Service (0x4c)"
"12","0.000586","192.168.1.20","192.168.1.50","TCP","64","52992  >  44818 [ACK] Seq=1 Ack=271 Win=8012 Len=0"
"13","0.000596","192.168.1.20","192.168.1.50","TCP","64","52992  >  44818 [ACK] Seq=1 Ack=361 Win=7946 Len=0"
"14","0.000599","192.168.1.20","192.168.1.10","CIP","108","Success: Service (0x4d)"
"15","0.000790","192.168.1.10","192.168.1.20","TCP","64","54084  >  44818 [ACK] Seq=1 Ack=51 Win=8142 Len=0"
"16","0.001094","192.168.1.20","192.168.1.50","CIP I/O","90","Connection: ID=0x00CD4016, SEQ=0001637049"
"17","0.001101","192.168.1.50","239.192.7.63","CIP I/O","102","Connection: ID=0x004D8000, SEQ=0001653685"
"18","0.001442","192.168.1.60","192.168.1.10","CIP","108","Success: Service (0x4d)"
"19","0.001448","192.168.1.70","192.168.1.10","CIP I/O","90","Connection: ID=0x004D4017, SEQ=0001649369"
"20","0.001450","192.168.1.60","192.168.1.10","CIP","116","Success: Service (0x4c)"
"21","0.001452","192.168.1.10","192.168.1.60","TCP","64","54082  >  44818 [ACK] Seq=1 Ack=51 Win=8142 Len=0"
"22","0.001455","192.168.1.40","192.168.1.10","CIP","108","Success: Service (0x4d)"
"23","0.001457","192.168.1.70","192.168.1.20","CIP I/O","90","Connection: ID=0x003C4007, SEQ=0001648672"
"24","0.001681","192.168.1.10","192.168.1.60","TCP","64","54082  >  44818 [ACK] Seq=1 Ack=109 Win=8134 Len=0"
"25","0.001687","192.168.1.60","192.168.1.30","CIP","152","Success: Service (0x4c)"
"26","0.001689","192.168.1.10","192.168.1.40","TCP","64","54088  >  44818 [ACK] Seq=1 Ack=51 Win=8142 Len=0"
"27","0.001690","192.168.1.30","192.168.1.60","TCP","64","52416  >  44818 [ACK] Seq=1 Ack=95 Win=8098 Len=0"
"28","0.002545","192.168.1.30","192.168.1.10","CIP","108","Success: Service (0x4d)"
"29","0.002551","192.168.1.30","192.168.1.10","CIP","116","Success: Service (0x4c)"
"30","0.002553","192.168.1.10","192.168.1.30","TCP","64","54086  >  44818 [ACK] Seq=147 Ack=51 Win=8142 Len=0"
"31","0.002558","192.168.1.10","192.168.1.20","CIP I/O","90","Connection: ID=0x00BC4017, SEQ=0001625153"
"32","0.002560","192.168.1.10","192.168.1.30","TCP","64","54086  >  44818 [ACK] Seq=147 Ack=109 Win=8084 Len=0"
"33","0.003348","192.168.1.200","192.168.1.60","CIP","112","Class (0xb2) - Service (0x4c)"
"34","0.003355","192.168.1.60","192.168.1.200","TCP","64","44818  >  56584 [ACK] Seq=1 Ack=55 Win=8138 Len=0"
"35","0.004330","192.168.1.50","192.168.1.40","CIP I/O","90","Connection: ID=0x003D4007, SEQ=0001630250"
"36","0.004337","192.168.1.200","192.168.1.50","CIP","112","Class (0xb2) - Service (0x4c)"
"37","0.004615","192.168.1.50","192.168.1.200","TCP","64","44818  >  56574 [ACK] Seq=1 Ack=55 Win=8138 Len=0"
"38","0.004621","192.168.1.20","192.168.1.60","CIP","148","Success: Service (0x4c)"
"39","0.004623","192.168.1.10","192.168.1.20","CIP","132","'HMI_PLANT_AUTO' - Service (0x4d)"
"40","0.004625","192.168.1.20","192.168.1.10","CIP","156","Success: Service (0x4c)"
"41","0.004628","192.168.1.60","192.168.1.20","TCP","64","52418  >  44818 [ACK] Seq=1 Ack=91 Win=8102 Len=0"
"42","0.004835","192.168.1.10","192.168.1.50","CIP","132","'HMI_PLANT_AUTO' - Service (0x4d)"
"43","0.004842","192.168.1.20","192.168.1.10","TCP","64","44818  >  54084 [ACK] Seq=149 Ack=75 Win=8118 Len=0"
"44","0.004844","192.168.1.10","192.168.1.20","TCP","64","54084  >  44818 [ACK] Seq=75 Ack=149 Win=8094 Len=0"
"45","0.004848","192.168.1.50","192.168.1.10","TCP","64","44818  >  54080 [ACK] Seq=1 Ack=75 Win=8118 Len=0"
"46","0.004849","192.168.1.10","192.168.1.50","CIP","122","'HMI_P5_STATE' - Service (0x4c)"
"47","0.005065","192.168.1.50","192.168.1.10","TCP","64","44818  >  54080 [ACK] Seq=1 Ack=139 Win=8128 Len=0"
"48","0.005071","192.168.1.10","192.168.1.40","CIP","134","'HMI_PLANT_RESET' - Service (0x4d)"
"49","0.005073","192.168.1.30","192.168.1.40","CIP I/O","90","Connection: ID=0x01BD4016, SEQ=0001638691"
"50","0.005075","192.168.1.10","192.168.1.40","CIP","128","'HMI_P4_PERMISSIVE' - Service (0x4c)"
"51","0.005078","192.168.1.40","192.168.1.10","TCP","64","44818  >  54088 [ACK] Seq=51 Ack=77 Win=8116 Len=0"
"52","0.005303","192.168.1.40","192.168.1.10","TCP","64","44818  >  54088 [ACK] Seq=51 Ack=147 Win=8046 Len=0"
"53","0.005309","192.168.1.10","192.168.1.60","CIP","132","'HMI_PLANT_AUTO' - Service (0x4d)"
"54","0.005311","192.168.1.200","192.168.1.30","CIP","112","Class (0xb2) - Service (0x4c)"
"55","0.005599","192.168.1.60","192.168.1.10","TCP","64","44818  >  54082 [ACK] Seq=109 Ack=75 Win=8118 Len=0"
"56","0.005606","192.168.1.30","192.168.1.200","TCP","64","44818  >  56582 [ACK] Seq=1 Ack=55 Win=8138 Len=0"
"57","0.005607","192.168.1.40","192.168.1.50","CIP I/O","90","Connection: ID=0x014D4024, SEQ=0001636637"
"58","0.006242","192.168.1.10","192.168.1.60","CIP I/O","90","Connection: ID=0x00334011, SEQ=0001624079"
"59","0.006249","192.168.1.10","192.168.1.50","CIP I/O","90","Connection: ID=0x004D4015, SEQ=0001625153"
"60","0.006251","192.168.1.10","192.168.1.30","CIP I/O","90","Connection: ID=0x00334010, SEQ=0001624128"
"61","0.006253","192.168.1.200","192.168.1.10","CIP","112","Class (0xb2) - Service (0x4c)"
"62","0.006256","192.168.1.10","192.168.1.40","CIP I/O","90","Connection: ID=0x013D4010, SEQ=0001622874"
"63","0.006536","192.168.1.10","192.168.1.200","TCP","64","44818  >  56578 [ACK] Seq=1 Ack=55 Win=8138 Len=0"
"64","0.006542","192.168.1.60","192.168.1.10","CIP","108","Success: Service (0x4d)"
"65","0.006544","192.168.1.10","192.168.1.60","TCP","64","54082  >  44818 [ACK] Seq=75 Ack=159 Win=8142 Len=0"
"66","0.006546","192.168.1.20","239.192.3.127","CIP I/O","102","Connection: ID=0x003C8000, SEQ=0001653659"
"67","0.007158","192.168.1.60","192.168.1.200","CIP","598","Success: Class (0xb2) - Service (0x4c)"
"68","0.007444","192.168.1.60","192.168.1.20","CIP I/O","90","Connection: ID=0x01BC401A, SEQ=0001637119"
"69","0.007450","192.168.1.30","192.168.1.60","CIP I/O","90","Connection: ID=0x00B34012, SEQ=0001639434"
"70","0.007815","192.168.1.30","239.192.4.191","CIP I/O","102","Connection: ID=0x00338000, SEQ=0001652856"
"71","0.007823","192.168.1.30","192.168.1.10","CIP","102","Success: Service (0x4d)"
"72","0.007825","192.168.1.40","239.192.5.255","CIP I/O","102","Connection: ID=0x003D8000, SEQ=0001651934"
"73","0.007829","192.168.1.200","192.168.1.20","CIP","112","Class (0xb2) - Service (0x4c)"
"74","0.007832","192.168.1.30","192.168.1.20","CIP","130","'HMI_P_NAOCL_UF_DUTY' - Service (0x4c)"
"75","0.007915","192.168.1.10","192.168.1.30","TCP","64","54086  >  44818 [ACK] Seq=147 Ack=153 Win=8148 Len=0"
"76","0.007921","192.168.1.20","192.168.1.200","TCP","64","44818  >  56580 [ACK] Seq=1 Ack=55 Win=8138 Len=0"
"77","0.007922","192.168.1.30","192.168.1.20","CIP","134","'P2_P2078_AUTOINP' - Service (0x4d)"
"78","0.008140","192.168.1.20","192.168.1.30","TCP","64","44818  >  52418 [ACK] Seq=1 Ack=73 Win=8120 Len=0"
"79","0.008146","192.168.1.20","192.168.1.30","TCP","64","44818  >  52418 [ACK] Seq=1 Ack=149 Win=8044 Len=0"
"80","0.008148","192.168.1.30","192.168.1.40","CIP","120","'HMI_LIT401' - Service (0x4c)"
"81","0.008428","192.168.1.60","192.168.1.10","CIP I/O","90","Connection: ID=0x00CD4026, SEQ=0001636941"
"82","0.008434","192.168.1.40","192.168.1.30","TCP","64","44818  >  52420 [ACK] Seq=1 Ack=63 Win=8130 Len=0"
"83","0.008435","192.168.1.20","192.168.1.40","CIP I/O","90","Connection: ID=0x00BD4009, SEQ=0001635308"
"84","0.008796","192.168.1.60","239.192.8.127","CIP I/O","102","Connection: ID=0x00338000, SEQ=0001652358"
"85","0.008804","192.168.1.20","192.168.1.30","CIP I/O","90","Connection: ID=0x00B34013, SEQ=0001636074"
"86","0.009732","192.168.1.10","192.168.1.200","CIP","598","Success: Class (0xb2) - Service (0x4c)"
"87","0.009745","192.168.1.30","192.168.1.20","CIP I/O","90","Connection: ID=0x013C4018, SEQ=0001640422"
"88","0.009752","192.168.1.50","192.168.1.10","CIP","108","Success: Service (0x4d)"
"89","0.009757","192.168.1.10","239.192.2.63","CIP I/O","102","Connection: ID=0x004D8000, SEQ=0001654367"
"90","0.009760","192.168.1.20","192.168.1.10","CIP","108","Success: 'HMI_PLANT_AUTO' - Service (0x4d)"
"91","0.009764","192.168.1.10","192.168.1.50","TCP","64","54080  >  44818 [ACK] Seq=139 Ack=51 Win=8142 Len=0"
"92","0.009766","192.168.1.50","192.168.1.40","CIP","120","Success: Service (0x4c)"
"93","0.009879","192.168.1.50","192.168.1.40","CIP","120","Success: Service (0x4c)"
"94","0.009887","192.168.1.20","192.168.1.30","CIP","120","'HMI_LIT301' - Service (0x4c)"
"95","0.009889","192.168.1.10","192.168.1.20","TCP","64","54084  >  44818 [ACK] Seq=75 Ack=199 Win=8142 Len=0"
"96","0.009892","192.168.1.40","192.168.1.50","TCP","64","53056  >  44818 [ACK] Seq=1 Ack=63 Win=8130 Len=0"
"97","0.009903","192.168.1.20","192.168.1.30","CIP","120","'HMI_MV301' - Service (0x4c)"
"98","0.009904","192.168.1.40","192.168.1.50","TCP","64","53056  >  44818 [ACK] Seq=1 Ack=125 Win=8068 Len=0"
"99","0.010077","192.168.1.30","192.168.1.20","TCP","64","44818  >  52994 [ACK] Seq=1 Ack=63 Win=8130 Len=0"
"100","0.010083","192.168.1.30","192.168.1.20","TCP","64","44818  >  52994 [ACK] Seq=1 Ack=125 Win=8068 Len=0"
"101","0.010085","192.168.1.20","192.168.1.40","CIP","120","'HMI_AIT402' - Service (0x4c)"
"102","0.010289","192.168.1.40","192.168.1.20","TCP","64","44818  >  52996 [ACK] Seq=1 Ack=63 Win=8130 Len=0"
"103","0.010471","192.168.1.20","192.168.1.200","CIP","598","Success: Class (0xb2) - Service (0x4c)"
"104","0.010481","192.168.1.20","192.168.1.30","CIP","116","Success: 'HMI_P_NAOCL_UF_DUTY' - Service (0x4c)"
"105","0.010485","192.168.1.200","192.168.1.40","CIP","112","Class (0xb2) - Service (0x4c)"
"106","0.010495","192.168.1.30","192.168.1.20","TCP","64","52418  >  44818 [ACK] Seq=149 Ack=59 Win=8134 Len=0"
"107","0.010497","192.168.1.40","192.168.1.200","TCP","64","44818  >  56585 [ACK] Seq=1 Ack=55 Win=8138 Len=0"
"108","0.011307","192.168.1.50","239.192.7.63","CIP I/O","102","Connection: ID=0x004D8000, SEQ=0001653686"
"109","0.011326","192.168.1.20","192.168.1.50","CIP I/O","90","Connection: ID=0x00CD4016, SEQ=0001637050"
"110","0.011334","192.168.1.40","192.168.1.10","CIP","108","Success: Service (0x4d)"
"111","0.011336","192.168.1.70","192.168.1.10","CIP I/O","90","Connection: ID=0x004D4017, SEQ=0001649370"
"112","0.011337","192.168.1.10","192.168.1.40","TCP","64","54088  >  44818 [ACK] Seq=147 Ack=101 Win=8142 Len=0"
"113","0.011550","192.168.1.70","192.168.1.20","CIP I/O","90","Connection: ID=0x003C4007, SEQ=0001648673"
"114","0.011561","192.168.1.60","192.168.1.10","CIP","108","Success: 'HMI_PLANT_AUTO' - Service (0x4d)"
"115","0.011783","192.168.1.60","192.168.1.10","CIP","120","'HMI_LIT101' - Service (0x4c)"
"116","0.011795","192.168.1.10","192.168.1.60","TCP","64","54082  >  44818 [ACK] Seq=75 Ack=209 Win=8142 Len=0"
"117","0.011798","192.168.1.60","192.168.1.20","CIP","120","'HMI_AIT202' - Service (0x4c)"
"118","0.011806","192.168.1.10","192.168.1.60","TCP","64","44818  >  52416 [ACK] Seq=1 Ack=63 Win=8130 Len=0"
"119","0.012043","192.168.1.20","192.168.1.60","TCP","64","44818  >  52418 [ACK] Seq=91 Ack=63 Win=8130 Len=0"
"120","0.013110","192.168.1.10","192.168.1.20","CIP I/O","90","Connection: ID=0x00BC4017, SEQ=0001625154"
"121","0.013123","192.168.1.200","192.168.1.70","CIP","112","Class (0xb2) - Service (0x4c)"
"122","0.013477","192.168.1.70","192.168.1.200","TCP","64","44818  >  54613 [ACK] Seq=1 Ack=55 Win=8138 Len=0"
"123","0.014542","192.168.1.50","192.168.1.40","CIP I/O","90","Connection: ID=0x003D4007, SEQ=0001630251"
"124","0.014555","192.168.1.200","192.168.1.60","CIP","112","Class (0xb2) - Service (0x4c)"
"125","0.014562","192.168.1.60","192.168.1.200","TCP","64","44818  >  56584 [ACK] Seq=541 Ack=109 Win=8138 Len=0"
"126","0.014953","192.168.1.70","192.168.1.200","CIP","598","Success: Class (0xb2) - Service (0x4c)"
"127","0.014966","192.168.1.10","192.168.1.60","CIP","148","Success: 'HMI_LIT101' - Service (0x4c)"
"128","0.014973","192.168.1.60","192.168.1.10","TCP","64","52416  >  44818 [ACK] Seq=63 Ack=91 Win=8102 Len=0"
"129","0.015222","192.168.1.30","192.168.1.40","CIP I/O","90","Connection: ID=0x01BD4016, SEQ=0001638692"
"130","0.015233","192.168.1.20","192.168.1.30","CIP","108","Success: 'P2_P2078_AUTOINP' - Service (0x4d)"
"131","0.015236","192.168.1.10","192.168.1.20","CIP","128","'HMI_PLANT' - Service (0x4d)"
"132","0.015245","192.168.1.30","192.168.1.20","TCP","64","52418  >  44818 [ACK] Seq=149 Ack=109 Win=8142 Len=0"
"133","0.015246","192.168.1.10","192.168.1.20","CIP","134","'HMI_PLANT_RESET' - Service (0x4d)"
"134","0.015249","192.168.1.10","192.168.1.20","CIP","128","'HMI_P2_PERMISSIVE' - Service (0x4c)"
"135","0.015431","192.168.1.20","192.168.1.10","TCP","64","44818  >  54084 [ACK] Seq=199 Ack=145 Win=8122 Len=0"
"136","0.015443","192.168.1.20","192.168.1.10","TCP","64","44818  >  54084 [ACK] Seq=199 Ack=221 Win=8046 Len=0"
"137","0.015447","192.168.1.20","192.168.1.10","TCP","64","44818  >  54084 [ACK] Seq=199 Ack=291 Win=7976 Len=0"
"138","0.015652","192.168.1.10","192.168.1.30","CIP","128","'HMI_PLANT' - Service (0x4d)"
"139","0.015663","192.168.1.10","192.168.1.30","CIP","128","'HMI_P3_PERMISSIVE' - Service (0x4c)"
"140","0.015667","192.168.1.20","192.168.1.50","CIP","120","'HMI_AIT501' - Service (0x4c)"
"141","0.015675","192.168.1.40","192.168.1.50","CIP I/O","90","Connection: ID=0x014D4024, SEQ=0001636638"
"142","0.015676","192.168.1.30","192.168.1.10","TCP","64","44818  >  54086 [ACK] Seq=153 Ack=217 Win=8122 Len=0"
"143","0.015679","192.168.1.20","192.168.1.50","CIP","120","'HMI_AIT502' - Service (0x4c)"
"144","0.015682","192.168.1.10","192.168.1.40","CIP","132","'HMI_PLANT_AUTO' - Service (0x4d)"
"145","0.015685","192.168.1.30","192.168.1.10","TCP","64","44818  >  54086 [ACK] Seq=153 Ack=287 Win=8052 Len=0"
"146","0.015736","192.168.1.20","192.168.1.50","CIP","120","'HMI_AIT503' - Service (0x4c)"
"147","0.015741","192.168.1.20","192.168.1.50","CIP","120","'HMI_AIT504' - Service (0x4c)"
"148","0.015744","192.168.1.50","192.168.1.20","TCP","64","44818  >  52992 [ACK] Seq=361 Ack=63 Win=8130 Len=0"
"149","0.015830","192.168.1.40","192.168.1.10","TCP","64","44818  >  54088 [ACK] Seq=101 Ack=221 Win=8118 Len=0"
"150","0.015835","192.168.1.50","192.168.1.20","TCP","64","44818  >  52992 [ACK] Seq=361 Ack=125 Win=8068 Len=0"
"151","0.015837","192.168.1.10","192.168.1.50","CIP","134","'HMI_PLANT_RESET' - Service (0x4d)"
"152","0.015840","192.168.1.50","192.168.1.20","TCP","64","44818  >  52992 [ACK] Seq=361 Ack=187 Win=8006 Len=0"
"153","0.015929","192.168.1.50","192.168.1.20","TCP","64","44818  >  52992 [ACK] Seq=361 Ack=249 Win=7944 Len=0"
"154","0.015934","192.168.1.200","192.168.1.20","CIP","112","Class (0xb2) - Service (0x4c)"
"155","0.015937","192.168.1.10","192.168.1.50","CIP","128","'HMI_P5_PERMISSIVE' - Service (0x4c)"
"156","0.015939","192.168.1.50","192.168.1.10","TCP","64","44818  >  54080 [ACK] Seq=51 Ack=215 Win=8116 Len=0"
"157","0.016105","192.168.1.20","192.168.1.200","TCP","64","44818  >  56580 [ACK] Seq=541 Ack=109 Win=8138 Len=0"
"158","0.016111","192.168.1.50","192.168.1.10","TCP","64","44818  >  54080 [ACK] Seq=51 Ack=285 Win=8046 Len=0"
"159","0.016114","192.168.1.10","192.168.1.60","CIP","134","'HMI_PLANT_RESET' - Service (0x4d)"
"160","0.016117","192.168.1.20","192.168.1.60","CIP","148","Success: 'HMI_AIT202' - Service (0x4c)"
"161","0.016120","192.168.1.60","192.168.1.10","TCP","64","44818  >  54082 [ACK] Seq=209 Ack=151 Win=8116 Len=0"
"162","0.016213","192.168.1.10","192.168.1.20","CIP CM","128","Unconnected Send: 'HMI_MV201' - Service (0x4c)"
"163","0.016218","192.168.1.40","192.168.1.10","CIP","108","Success: 'HMI_PLANT_RESET' - Service (0x4d)"
"164","0.016221","192.168.1.60","192.168.1.20","TCP","64","52418  >  44818 [ACK] Seq=63 Ack=181 Win=8102 Len=0"
"165","0.016323","192.168.1.20","192.168.1.10","TCP","64","44818  >  54084 [ACK] Seq=199 Ack=361 Win=8122 Len=0"
"166","0.016329","192.168.1.40","192.168.1.10","CIP","116","Success: 'HMI_P4_PERMISSIVE' - Service (0x4c)"
"167","0.016332","192.168.1.10","192.168.1.60","CIP I/O","90","Connection: ID=0x00334011, SEQ=0001624080"
"168","0.016334","192.168.1.10","192.168.1.50","CIP I/O","90","Connection: ID=0x004D4015, SEQ=0001625154"
"169","0.016406","192.168.1.40","192.168.1.30","CIP","148","Success: 'HMI_LIT401' - Service (0x4c)"
"170","0.016411","192.168.1.10","192.168.1.30","CIP I/O","90","Connection: ID=0x00334010, SEQ=0001624129"
"171","0.016414","192.168.1.10","192.168.1.40","TCP","64","54088  >  44818 [ACK] Seq=221 Ack=151 Win=8142 Len=0"
"172","0.016416","192.168.1.10","192.168.1.40","CIP I/O","90","Connection: ID=0x013D4010, SEQ=0001622875"
"173","0.016607","192.168.1.10","192.168.1.40","TCP","64","54088  >  44818 [ACK] Seq=221 Ack=209 Win=8084 Len=0"
"174","0.016613","192.168.1.30","192.168.1.40","TCP","64","52420  >  44818 [ACK] Seq=63 Ack=91 Win=8102 Len=0"
"175","0.016616","192.168.1.20","239.192.3.127","CIP I/O","102","Connection: ID=0x003C8000, SEQ=0001653660"
"176","0.016621","192.168.1.40","192.168.1.20","CIP","148","Success: 'HMI_AIT402' - Service (0x4c)"
"177","0.016917","192.168.1.20","192.168.1.40","TCP","64","52996  >  44818 [ACK] Seq=63 Ack=91 Win=8102 Len=0"
"178","0.017206","192.168.1.60","192.168.1.200","CIP","598","Success: Class (0xb2) - Service (0x4c)"
"179","0.017448","192.168.1.60","192.168.1.20","CIP I/O","90","Connection: ID=0x01BC401A, SEQ=0001637120"
"180","0.017460","192.168.1.30","192.168.1.60","CIP I/O","90","Connection: ID=0x00B34012, SEQ=0001639435"
"181","0.017940","192.168.1.30","239.192.4.191","CIP I/O","102","Connection: ID=0x00338000, SEQ=0001652857"
"182","0.017954","192.168.1.40","239.192.5.255","CIP I/O","102","Connection: ID=0x003D8000, SEQ=0001651935"
"183","0.018433","192.168.1.60","192.168.1.10","CIP I/O","90","Connection: ID=0x00CD4026, SEQ=0001636942"
"184","0.018446","192.168.1.20","192.168.1.40","CIP I/O","90","Connection: ID=0x00BD4009, SEQ=0001635309"
"185","0.018844","192.168.1.60","239.192.8.127","CIP I/O","102","Connection: ID=0x00338000, SEQ=0001652359"
"186","0.018858","192.168.1.20","192.168.1.30","CIP I/O","90","Connection: ID=0x00B34013, SEQ=0001636075"
"187","0.019697","192.168.1.10","192.168.1.60","CIP","128","'HMI_P6_PERMISSIVE' - Service (0x4c)"
"188","0.019710","192.168.1.50","192.168.1.10","CIP","108","Success: Service (0x4d)"
"189","0.019717","192.168.1.30","192.168.1.20","CIP I/O","90","Connection: ID=0x013C4018, SEQ=0001640423"
"190","0.019719","192.168.1.60","192.168.1.10","TCP","64","44818  >  54082 [ACK] Seq=209 Ack=221 Win=8122 Len=0"
"191","0.019723","192.168.1.10","239.192.2.63","CIP I/O","102","Connection: ID=0x004D8000, SEQ=0001654368"
"192","0.019726","192.168.1.50","192.168.1.10","CIP","116","Success: Service (0x4c)"
"193","0.019857","192.168.1.10","192.168.1.50","TCP","64","54080  >  44818 [ACK] Seq=285 Ack=101 Win=8142 Len=0"
"194","0.019867","192.168.1.50","192.168.1.40","CIP","132","'HMI_RO_HPP_SD' - Service (0x4d)"
"195","0.019870","192.168.1.10","192.168.1.50","TCP","64","54080  >  44818 [ACK] Seq=285 Ack=159 Win=8084 Len=0"
"196","0.019880","192.168.1.50","192.168.1.40","CIP","120","'HMI_UV401' - Service (0x4c)"
"197","0.020110","192.168.1.40","192.168.1.50","TCP","64","44818  >  54084 [ACK] Seq=1 Ack=75 Win=8118 Len=0"
"198","0.020122","192.168.1.40","192.168.1.50","TCP","64","44818  >  54084 [ACK] Seq=1 Ack=137 Win=8056 Len=0"
"199","0.020125","192.168.1.10","192.168.1.20","CIP","120","'HMI_FIT201' - Service (0x4c)"
"200","0.020133","192.168.1.10","192.168.1.20","CIP","132","'HMI_PLANT_AUTO' - Service (0x4d)"
"201","0.020247","192.168.1.20","192.168.1.10","TCP","64","44818  >  54084 [ACK] Seq=199 Ack=423 Win=8130 Len=0"
"202","0.020252","192.168.1.10","192.168.1.60","CIP","128","'HMI_PLANT' - Service (0x4d)"
"203","0.020255","192.168.1.20","192.168.1.10","TCP","64","44818  >  54084 [ACK] Seq=199 Ack=497 Win=8056 Len=0"
"204","0.020339","192.168.1.50","192.168.1.200","CIP","598","Success: Class (0xb2) - Service (0x4c)"
"205","0.020344","192.168.1.50","192.168.1.40","CIP CM","128","Unconnected Send: 'HMI_FIT401' - Service (0x4c)"
"206","0.020347","192.168.1.10","192.168.1.60","CIP","132","'HMI_PLANT_AUTO' - Service (0x4d)"
"207","0.020349","192.168.1.60","192.168.1.10","TCP","64","44818  >  54082 [ACK] Seq=209 Ack=291 Win=8122 Len=0"
"208","0.020594","192.168.1.60","192.168.1.10","TCP","64","44818  >  54082 [ACK] Seq=209 Ack=365 Win=8118 Len=0"
"209","0.020600","192.168.1.40","192.168.1.50","TCP","64","44818  >  54084 [ACK] Seq=1 Ack=207 Win=8122 Len=0"
"210","0.020603","192.168.1.10","192.168.1.40","CIP","128","'HMI_PLANT' - Service (0x4d)"
"211","0.020605","192.168.1.40","192.168.1.10","TCP","64","44818  >  54088 [ACK] Seq=209 Ack=291 Win=8122 Len=0"
"212","0.020809","192.168.1.10","192.168.1.50","CIP","128","'HMI_PLANT' - Service (0x4d)"
"213","0.020815","192.168.1.50","192.168.1.10","TCP","64","44818  >  54080 [ACK] Seq=159 Ack=355 Win=8122 Len=0"
"214","0.020816","192.168.1.10","192.168.1.30","CIP CM","140","Unconnected Send: 'HMI_PLANT_AUTO' - Service (0x4d)"
"215","0.021056","192.168.1.30","192.168.1.10","TCP","64","44818  >  54086 [ACK] Seq=153 Ack=369 Win=8110 Len=0"
"216","0.021302","192.168.1.50","239.192.7.63","CIP I/O","102","Connection: ID=0x004D8000, SEQ=0001653687"
"217","0.021309","192.168.1.20","192.168.1.50","CIP I/O","90","Connection: ID=0x00CD4016, SEQ=0001637051"
"218","0.021313","192.168.1.40","192.168.1.200","CIP","598","Success: Class (0xb2) - Service (0x4c)"
"219","0.021506","192.168.1.70","192.168.1.10","CIP I/O","90","Connection: ID=0x004D4017, SEQ=0001649371"
"220","0.021512","192.168.1.70","192.168.1.20","CIP I/O","90","Connection: ID=0x003C4007, SEQ=0001648674"
"221","0.022369","192.168.1.30","192.168.1.10","CIP","108","Success: 'HMI_PLANT_RESET' - Service (0x4d)"
"222","0.022379","192.168.1.10","192.168.1.30","TCP","64","54086  >  44818 [ACK] Seq=369 Ack=203 Win=8142 Len=0"
"223","0.022381","192.168.1.30","192.168.1.10","CIP","142","Success: 'HMI_LIT301' - Service (0x4c)"
"224","0.022571","192.168.1.10","192.168.1.30","TCP","64","54086  >  44818 [ACK] Seq=369 Ack=287 Win=8108 Len=0"
"225","0.022947","192.168.1.30","192.168.1.200","CIP","598","Success: Class (0xb2) - Service (0x4c)"
"226","0.022950","192.168.1.30","192.168.1.20","CIP","148","Success: 'HMI_LIT301' - Service (0x4c)"
"227","0.022952","192.168.1.30","192.168.1.20","CIP","120","Success: 'HMI_MV301' - Service (0x4c)"
"228","0.022954","192.168.1.10","192.168.1.20","CIP I/O","90","Connection: ID=0x00BC4017, SEQ=0001625155"
"229","0.023109","192.168.1.20","192.168.1.30","TCP","64","52994  >  44818 [ACK] Seq=125 Ack=91 Win=8102 Len=0"
"230","0.023113","192.168.1.30","192.168.1.60","CIP","134","'P6_P602_AUTOINP' - Service (0x4d)"
"231","0.023114","192.168.1.20","192.168.1.30","TCP","64","52994  >  44818 [ACK] Seq=125 Ack=153 Win=8040 Len=0"
"232","0.023116","192.168.1.60","192.168.1.30","TCP","64","44818  >  52416 [ACK] Seq=95 Ack=77 Win=8116 Len=0"
"233","0.023346","192.168.1.200","192.168.1.50","CIP","112","Class (0xb2) - Service (0x4c)"
"234","0.023350","192.168.1.50","192.168.1.200","TCP","64","44818  >  56574 [ACK] Seq=541 Ack=109 Win=8138 Len=0"
"235","0.024576","192.168.1.50","192.168.1.40","CIP I/O","90","Connection: ID=0x003D4007, SEQ=0001630252"
"236","0.025488","192.168.1.30","192.168.1.40","CIP I/O","90","Connection: ID=0x01BD4016, SEQ=0001638693"
"237","0.025493","192.168.1.20","192.168.1.10","CIP","108","Success: 'HMI_PLANT' - Service (0x4d)"
"238","0.025733","192.168.1.10","192.168.1.20","TCP","64","54084  >  44818 [ACK] Seq=497 Ack=249 Win=8142 Len=0"
"239","0.025736","192.168.1.40","192.168.1.50","CIP I/O","90","Connection: ID=0x014D4024, SEQ=0001636639"
"240","0.025739","192.168.1.200","192.168.1.201","TCP","1518","4241  >  60948 [ACK] Seq=1 Ack=1 Win=255 Len=1460"
"241","0.025742","192.168.1.200","192.168.1.201","TCP","1308","4241  >  60948 [PSH, ACK] Seq=1461 Ack=1 Win=255 Len=1250"
"242","0.025975","192.168.1.201","192.168.1.200","TCP","64","60948  >  4241 [ACK] Seq=1 Ack=2711 Win=16425 Len=0"
"243","0.026224","192.168.1.201","192.168.1.200","TCP","154","60948  >  4241 [PSH, ACK] Seq=1 Ack=2711 Win=16425 Len=96"
"244","0.026228","192.168.1.200","192.168.1.88","TCP","1518","4241  >  53903 [ACK] Seq=1 Ack=1 Win=255 Len=1460"
"245","0.026231","192.168.1.200","192.168.1.88","TCP","1308","4241  >  53903 [PSH, ACK] Seq=1461 Ack=1 Win=255 Len=1250"
"246","0.026430","192.168.1.10","192.168.1.60","CIP I/O","90","Connection: ID=0x00334011, SEQ=0001624081"
"247","0.026433","192.168.1.10","192.168.1.50","CIP I/O","90","Connection: ID=0x004D4015, SEQ=0001625155"
"248","0.026435","192.168.1.10","192.168.1.30","CIP I/O","90","Connection: ID=0x00334010, SEQ=0001624130"
"249","0.026437","192.168.1.10","192.168.1.40","CIP I/O","90","Connection: ID=0x013D4010, SEQ=0001622876"
"250","0.026716","192.168.1.20","239.192.3.127","CIP I/O","102","Connection: ID=0x003C8000, SEQ=0001653661"
"251","0.026909","192.168.1.60","192.168.1.10","CIP","108","Success: 'HMI_PLANT_RESET' - Service (0x4d)"
"252","0.026913","192.168.1.200","192.168.1.40","CIP","112","Class (0xb2) - Service (0x4c)"
"253","0.026914","192.168.1.10","192.168.1.60","TCP","64","54082  >  44818 [ACK] Seq=365 Ack=259 Win=8142 Len=0"
"254","0.026916","192.168.1.40","192.168.1.200","TCP","64","44818  >  56585 [ACK] Seq=541 Ack=109 Win=8138 Len=0"
"255","0.027209","192.168.1.88","192.168.1.200","TCP","64","53903  >  4241 [ACK] Seq=1 Ack=2711 Win=1237 Len=0"
"256","0.027212","192.168.1.60","192.168.1.10","CIP","116","Success: 'HMI_P6_PERMISSIVE' - Service (0x4c)"
"257","0.027214","192.168.1.10","192.168.1.60","TCP","64","54082  >  44818 [ACK] Seq=365 Ack=317 Win=8134 Len=0"
"258","0.027534","192.168.1.60","192.168.1.20","CIP I/O","90","Connection: ID=0x01BC401A, SEQ=0001637121"
"259","0.027538","192.168.1.30","192.168.1.60","CIP I/O","90","Connection: ID=0x00B34012, SEQ=0001639436"
"260","0.027904","192.168.1.30","239.192.4.191","CIP I/O","102","Connection: ID=0x00338000, SEQ=0001652858"
"261","0.027908","192.168.1.40","239.192.5.255","CIP I/O","102","Connection: ID=0x003D8000, SEQ=0001651936"
"262","0.028212","192.168.1.30","192.168.1.10","CIP","108","Success: 'HMI_PLANT' - Service (0x4d)"
"263","0.028215","192.168.1.88","192.168.1.200","TCP","154","53903  >  4241 [PSH, ACK] Seq=1 Ack=2711 Win=1237 Len=96"
"264","0.028217","192.168.1.10","192.168.1.30","TCP","64","54086  >  44818 [ACK] Seq=369 Ack=337 Win=8142 Len=0"
"265","0.028219","192.168.1.30","192.168.1.10","CIP","116","Success: 'HMI_P3_PERMISSIVE' - Service (0x4c)"
"266","0.028478","192.168.1.10","192.168.1.30","TCP","64","54086  >  44818 [ACK] Seq=369 Ack=395 Win=8134 Len=0"
"267","0.028481","192.168.1.60","192.168.1.10","CIP I/O","90","Connection: ID=0x00CD4026, SEQ=0001636943"
"268","0.028803","192.168.1.60","239.192.8.127","CIP I/O","102","Connection: ID=0x00338000, SEQ=0001652360"
"269","0.028808","192.168.1.20","192.168.1.40","CIP I/O","90","Connection: ID=0x00BD4009, SEQ=0001635310"
"270","0.029133","192.168.1.20","192.168.1.30","CIP I/O","90","Connection: ID=0x00B34013, SEQ=0001636076"
"271","0.029830","192.168.1.30","192.168.1.20","CIP I/O","90","Connection: ID=0x013C4018, SEQ=0001640424"
"272","0.029834","192.168.1.10","239.192.2.63","CIP I/O","102","Connection: ID=0x004D8000, SEQ=0001654369"
"273","0.029837","192.168.1.10","192.168.1.40","CIP","134","'HMI_PLANT_RESET' - Service (0x4d)"
"274","0.029838","192.168.1.10","192.168.1.40","CIP","128","'HMI_P4_PERMISSIVE' - Service (0x4c)"
"275","0.030029","192.168.1.40","192.168.1.10","TCP","64","44818  >  54088 [ACK] Seq=209 Ack=367 Win=8116 Len=0"
"276","0.030033","192.168.1.50","192.168.1.10","CIP","108","Success: 'HMI_PLANT_AUTO' - Service (0x4d)"
"277","0.030035","192.168.1.40","192.168.1.10","TCP","64","44818  >  54088 [ACK] Seq=209 Ack=437 Win=8046 Len=0"
"278","0.030037","192.168.1.50","192.168.1.10","CIP","112","Success: 'HMI_P5_STATE' - Service (0x4c)"
"279","0.030039","192.168.1.10","192.168.1.50","TCP","64","54080  >  44818 [ACK] Seq=355 Ack=209 Win=8142 Len=0"
"280","0.030322","192.168.1.10","192.168.1.50","TCP","64","54080  >  44818 [ACK] Seq=355 Ack=263 Win=8088 Len=0"
"281","0.030325","192.168.1.50","192.168.1.40","CIP","128","'HMI_P_RO_FEED_DUTY' - Service (0x4c)"
"282","0.030327","192.168.1.40","192.168.1.50","TCP","64","44818  >  54084 [ACK] Seq=1 Ack=277 Win=8122 Len=0"
"283","0.030329","192.168.1.10","192.168.1.30","CIP CM","128","Unconnected Send: 'HMI_LIT301' - Service (0x4c)"
"284","0.030515","192.168.1.50","192.168.1.20","CIP","148","Success: 'HMI_AIT501' - Service (0x4c)"
"285","0.030519","192.168.1.50","192.168.1.20","CIP","148","Success: 'HMI_AIT502' - Service (0x4c)"
"286","0.030521","192.168.1.30","192.168.1.10","TCP","64","44818  >  54086 [ACK] Seq=395 Ack=439 Win=8122 Len=0"
"287","0.030523","192.168.1.50","192.168.1.20","CIP","148","Success: 'HMI_AIT503' - Service (0x4c)"
"288","0.030524","192.168.1.20","192.168.1.50","TCP","64","52992  >  44818 [ACK] Seq=249 Ack=451 Win=8102 Len=0"
"289","0.030730","192.168.1.20","192.168.1.50","TCP","64","52992  >  44818 [ACK] Seq=249 Ack=541 Win=8012 Len=0"
"290","0.030734","192.168.1.20","192.168.1.50","TCP","64","52992  >  44818 [ACK] Seq=249 Ack=631 Win=7922 Len=0"
"291","0.030736","192.168.1.50","192.168.1.20","CIP","148","Success: 'HMI_AIT504' - Service (0x4c)"
"292","0.030737","192.168.1.20","192.168.1.50","TCP","64","52992  >  44818 [ACK] Seq=249 Ack=721 Win=8102 Len=0"
"293","0.031015","192.168.1.20","192.168.1.10","CIP","108","Success: 'HMI_PLANT_RESET' - Service (0x4d)"
"294","0.031019","192.168.1.20","192.168.1.10","CIP","116","Success: 'HMI_P2_PERMISSIVE' - Service (0x4c)"
"295","0.031021","192.168.1.10","192.168.1.20","TCP","64","54084  >  44818 [ACK] Seq=497 Ack=299 Win=8142 Len=0"
"296","0.031022","192.168.1.10","192.168.1.20","TCP","64","54084  >  44818 [ACK] Seq=497 Ack=357 Win=8084 Len=0"
"297","0.031255","192.168.1.40","192.168.1.10","CIP","108","Success: 'HMI_PLANT_AUTO' - Service (0x4d)"
"298","0.031258","192.168.1.50","239.192.7.63","CIP I/O","102","Connection: ID=0x004D8000, SEQ=0001653688"
"299","0.031261","192.168.1.10","192.168.1.40","TCP","64","54088  >  44818 [ACK] Seq=437 Ack=259 Win=8142 Len=0"
"300","0.031262","192.168.1.20","192.168.1.50","CIP I/O","90","Connection: ID=0x00CD4016, SEQ=0001637052"
"301","0.031549","192.168.1.70","192.168.1.10","CIP I/O","90","Connection: ID=0x004D4017, SEQ=0001649372"
"302","0.031553","192.168.1.70","192.168.1.20","CIP I/O","90","Connection: ID=0x003C4007, SEQ=0001648675"
"303","0.032162","192.168.1.60","192.168.1.10","CIP","108","Success: 'HMI_PLANT' - Service (0x4d)"
"304","0.032166","192.168.1.10","192.168.1.60","TCP","64","54082  >  44818 [ACK] Seq=365 Ack=367 Win=8142 Len=0"
"305","0.032711","192.168.1.30","192.168.1.60","CIP","118","'HMI_P602' - Service (0x4c)"
"306","0.032715","192.168.1.30","192.168.1.60","CIP","118","'HMI_P602' - Service (0x4c)"
"307","0.032717","192.168.1.60","192.168.1.30","TCP","64","44818  >  52416 [ACK] Seq=95 Ack=137 Win=8132 Len=0"
"308","0.032719","192.168.1.60","192.168.1.30","TCP","64","44818  >  52416 [ACK] Seq=95 Ack=197 Win=8072 Len=0"
"309","0.032933","192.168.1.30","192.168.1.20","CIP","130","'HMI_P_NAOCL_UF_DUTY' - Service (0x4c)"
"310","0.032937","192.168.1.30","192.168.1.20","CIP","134","'P2_P2078_AUTOINP' - Service (0x4d)"
"311","0.032939","192.168.1.20","192.168.1.30","TCP","64","44818  >  52418 [ACK] Seq=109 Ack=221 Win=8120 Len=0"
"312","0.032941","192.168.1.20","192.168.1.30","TCP","64","44818  >  52418 [ACK] Seq=109 Ack=297 Win=8116 Len=0"
"313","0.033106","192.168.1.30","192.168.1.10","CIP","102","Success: 'HMI_PLANT_AUTO' - Service (0x4d)"
"314","0.033110","192.168.1.10","192.168.1.20","CIP I/O","90","Connection: ID=0x00BC4017, SEQ=0001625156"
"315","0.033112","192.168.1.10","192.168.1.30","TCP","64","54086  >  44818 [ACK] Seq=439 Ack=439 Win=8148 Len=0"
"316","0.033114","192.168.1.30","192.168.1.10","CIP","142","Success: 'HMI_LIT301' - Service (0x4c)"
"317","0.033382","192.168.1.10","192.168.1.30","TCP","64","54086  >  44818 [ACK] Seq=439 Ack=523 Win=8108 Len=0"
"318","0.034815","192.168.1.50","192.168.1.40","CIP I/O","90","Connection: ID=0x003D4007, SEQ=0001630253"
"319","0.035297","192.168.1.20","192.168.1.200","CIP","598","Success: Class (0xb2) - Service (0x4c)"
"320","0.035301","192.168.1.20","192.168.1.10","CIP","114","Success: 'HMI_MV201' - Service (0x4c)"
"321","0.035303","192.168.1.10","192.168.1.30","CIP","134","'HMI_PLANT_RESET' - Service (0x4d)"
"322","0.035305","192.168.1.30","192.168.1.40","CIP I/O","90","Connection: ID=0x01BD4016, SEQ=0001638694"
"323","0.035308","192.168.1.20","192.168.1.10","CIP","156","Success: 'HMI_FIT201' - Service (0x4c)"
"324","0.035310","192.168.1.10","192.168.1.30","CIP","128","'HMI_PLANT' - Service (0x4d)"
"325","0.035352","192.168.1.10","192.168.1.20","TCP","64","54084  >  44818 [ACK] Seq=497 Ack=413 Win=8136 Len=0"
"326","0.035356","192.168.1.30","192.168.1.10","TCP","64","44818  >  54086 [ACK] Seq=523 Ack=515 Win=8116 Len=0"
"327","0.035594","192.168.1.30","192.168.1.10","TCP","64","44818  >  54086 [ACK] Seq=523 Ack=585 Win=8046 Len=0"
"328","0.035597","192.168.1.10","192.168.1.20","TCP","64","54084  >  44818 [ACK] Seq=497 Ack=511 Win=8038 Len=0"
"329","0.035599","192.168.1.10","192.168.1.30","CIP","128","'HMI_P3_PERMISSIVE' - Service (0x4c)"
"330","0.035716","192.168.1.30","192.168.1.10","TCP","64","44818  >  54086 [ACK] Seq=523 Ack=655 Win=8122 Len=0"
"331","0.035720","192.168.1.10","192.168.1.50","CIP","140","'HMI_SHUTDOWN_FLUSHING' - Service (0x4d)"
"332","0.035722","192.168.1.40","192.168.1.50","CIP I/O","90","Connection: ID=0x014D4024, SEQ=0001636640"
"333","0.035724","192.168.1.10","192.168.1.50","CIP","134","'HMI_P5_SD_FLUSHING_DONE' - Service (0x4c)"
"334","0.035912","192.168.1.50","192.168.1.10","TCP","64","44818  >  54080 [ACK] Seq=263 Ack=437 Win=8110 Len=0"
"335","0.035916","192.168.1.20","192.168.1.10","CIP","108","Success: 'HMI_PLANT_AUTO' - Service (0x4d)"
"336","0.035918","192.168.1.50","192.168.1.10","TCP","64","44818  >  54080 [ACK] Seq=263 Ack=513 Win=8034 Len=0"
"337","0.035922","192.168.1.10","192.168.1.20","TCP","64","54084  >  44818 [ACK] Seq=497 Ack=561 Win=8142 Len=0"
"338","0.036168","192.168.1.10","192.168.1.20","CIP","128","'HMI_PLANT' - Service (0x4d)"
"339","0.036173","192.168.1.20","192.168.1.10","TCP","64","44818  >  54084 [ACK] Seq=561 Ack=567 Win=8122 Len=0"
"340","0.036175","192.168.1.10","192.168.1.60","CIP","134","'HMI_PLANT_RESET' - Service (0x4d)"
"341","0.036177","192.168.1.10","192.168.1.60","CIP","128","'HMI_P6_PERMISSIVE' - Service (0x4c)"
"342","0.036414","192.168.1.60","192.168.1.10","TCP","64","44818  >  54082 [ACK] Seq=367 Ack=441 Win=8116 Len=0"
"343","0.036418","192.168.1.60","192.168.1.10","TCP","64","44818  >  54082 [ACK] Seq=367 Ack=511 Win=8046 Len=0"
"344","0.036420","192.168.1.10","192.168.1.60","CIP I/O","90","Connection: ID=0x00334011, SEQ=0001624082"
"345","0.036422","192.168.1.10","192.168.1.50","CIP I/O","90","Connection: ID=0x004D4015, SEQ=0001625156"
"346","0.036537","192.168.1.40","192.168.1.50","CIP","108","Success: 'HMI_RO_HPP_SD' - Service (0x4d)"
"347","0.036541","192.168.1.10","192.168.1.30","CIP I/O","90","Connection: ID=0x00334010, SEQ=0001624131"
"348","0.036543","192.168.1.20","239.192.3.127","CIP I/O","102","Connection: ID=0x003C8000, SEQ=0001653662"
"349","0.036545","192.168.1.10","192.168.1.40","CIP I/O","90","Connection: ID=0x013D4010, SEQ=0001622877"
"350","0.036741","192.168.1.50","192.168.1.40","TCP","64","54084  >  44818 [ACK] Seq=277 Ack=51 Win=8142 Len=0"
"351","0.036745","192.168.1.40","192.168.1.50","CIP","152","Success: 'HMI_UV401' - Service (0x4c)"
"352","0.036747","192.168.1.50","192.168.1.40","TCP","64","54084  >  44818 [ACK] Seq=277 Ack=145 Win=8098 Len=0"
"353","0.036946","192.168.1.40","192.168.1.50","CIP","150","Success: 'HMI_FIT401' - Service (0x4c)"
"354","0.036950","192.168.1.50","192.168.1.40","TCP","64","54084  >  44818 [ACK] Seq=277 Ack=237 Win=8100 Len=0"
"355","0.037315","192.168.1.60","192.168.1.10","CIP","108","Success: 'HMI_PLANT_AUTO' - Service (0x4d)"
"356","0.037319","192.168.1.60","192.168.1.10","CIP","120","'HMI_LIT101' - Service (0x4c)"
"357","0.037321","192.168.1.10","192.168.1.60","TCP","64","54082  >  44818 [ACK] Seq=511 Ack=417 Win=8142 Len=0"
"358","0.037519","192.168.1.10","192.168.1.60","TCP","64","44818  >  52416 [ACK] Seq=91 Ack=125 Win=8130 Len=0"
"359","0.037523","192.168.1.60","192.168.1.20","CIP I/O","90","Connection: ID=0x01BC401A, SEQ=0001637122"
"360","0.037766","192.168.1.30","192.168.1.60","CIP I/O","90","Connection: ID=0x00B34012, SEQ=0001639437"
"361","0.037770","192.168.1.30","239.192.4.191","CIP I/O","102","Connection: ID=0x00338000, SEQ=0001652859"
"362","0.037773","192.168.1.40","239.192.5.255","CIP I/O","102","Connection: ID=0x003D8000, SEQ=0001651937"
"363","0.038708","192.168.1.60","192.168.1.10","CIP I/O","90","Connection: ID=0x00CD4026, SEQ=0001636944"
"364","0.038712","192.168.1.60","239.192.8.127","CIP I/O","102","Connection: ID=0x00338000, SEQ=0001652361"
"365","0.038714","192.168.1.20","192.168.1.40","CIP I/O","90","Connection: ID=0x00BD4009, SEQ=0001635311"
"366","0.039158","192.168.1.20","192.168.1.30","CIP I/O","90","Connection: ID=0x00B34013, SEQ=0001636077"
"367","0.039845","192.168.1.30","192.168.1.20","CIP I/O","90","Connection: ID=0x013C4018, SEQ=0001640425"
"368","0.039849","192.168.1.10","239.192.2.63","CIP I/O","102","Connection: ID=0x004D8000, SEQ=0001654370"
"369","0.039852","192.168.1.10","192.168.1.60","CIP","148","Success: 'HMI_LIT101' - Service (0x4c)"
"370","0.039854","192.168.1.200","192.168.1.201","TCP","680","4241  >  60948 [PSH, ACK] Seq=2711 Ack=97 Win=254 Len=622"
"371","0.040059","192.168.1.60","192.168.1.10","TCP","64","52416  >  44818 [ACK] Seq=125 Ack=181 Win=8102 Len=0"
"372","0.040064","192.168.1.50","192.168.1.10","CIP","108","Success: 'HMI_PLANT_RESET' - Service (0x4d)"
"373","0.040065","192.168.1.10","192.168.1.50","TCP","64","54080  >  44818 [ACK] Seq=513 Ack=313 Win=8142 Len=0"
"374","0.040191","192.168.1.50","192.168.1.10","CIP","116","Success: 'HMI_P5_PERMISSIVE' - Service (0x4c)"
"375","0.040195","192.168.1.200","192.168.1.88","TCP","680","4241  >  53903 [PSH, ACK] Seq=2711 Ack=97 Win=255 Len=622"
"376","0.040197","192.168.1.10","192.168.1.50","TCP","64","54080  >  44818 [ACK] Seq=513 Ack=371 Win=8134 Len=0"
"377","0.040427","192.168.1.201","192.168.1.200","TCP","154","60948  >  4241 [PSH, ACK] Seq=97 Ack=3333 Win=16269 Len=96"
"378","0.040431","192.168.1.20","192.168.1.30","CIP","116","Success: 'HMI_P_NAOCL_UF_DUTY' - Service (0x4c)"
"379","0.040714","192.168.1.30","192.168.1.20","TCP","64","52418  >  44818 [ACK] Seq=297 Ack=167 Win=8134 Len=0"
"380","0.041289","192.168.1.50","239.192.7.63","CIP I/O","102","Connection: ID=0x004D8000, SEQ=0001653689"
"381","0.041534","192.168.1.70","192.168.1.10","CIP I/O","90","Connection: ID=0x004D4017, SEQ=0001649373"
